komentar,clean,sentimen
@HorrorMine was the monk that buried the evil Grandpa there good or evil?  Because he buried the stake to cause evil and still went to bury the man that was selling his people there too . Getting mixed feelings about him,horrormine was the monk that buried the evil grandpa there good or evil because he buried the stake to cause evil and still went to bury the man that was selling his people there too getting mixed feelings about him,1
@horrormine I hope things improve greatly for you. Thank you for incredible content!,horrormine i hope things improve greatly for you thank you for incredible content,1
"Bby, real life comes before youtube always. Don't be sorry, I hope everything is going well. ❤",bby real life comes before youtube always dont be sorry i hope everything is going well,1
"The following info is on the Japan Live website:

""Hahakigami, the Broom Spirit:

""...Brooms in Japan started out as religious instruments and were swung in the air for ritual purification. As such, the Hahakigami isn't a mere broom but cleans out everything that is unwanted"".",the following info is on the japan live websitehahakitidakmi the broom spiritbrooms in japan started out as religious instruments and were swung in the air for ritual purification as such the hahakitidakmi isnt a mere broom but cleans out everything that is unwanted,1
"It's okay, just take your time!",its okay just take your time,1
🤗 Please take all the time you need. We'll still be here for you. Thanks for the video~,please take all the time you need well still be here for you thanks for the video,1
It's all good!,its all good,1
"Take care if yourself man we can wait. Mental health/health first , youtube second. We can be patient 😊😊",take care if yourself man we can wait mental healthhealth first youtube second we can be patient,1
@horror it's okay you don't have to be pressure. we're just waiting for you. hopefully you can do a review on memento mori or wishing stairs,horror its okay you dont have to be pressure were just waiting for you hopefully you can do a review on memento mori or wishing stairs,1
Hope you’re all right! We love you and are here for you. Thank you for another great video! Take your time with uploads and take care of yourself. You come first!,hope youre all right we love you and are here for you thank you for another great video take your time with uploads and take care of yourself you come first,1
"Have you see the ""Art of the Devil "" ? It's a Thai film.",have you see the art of the devil its a thai film,1
WELCOME BACK! Glad to see your video pop up again! I hope everything is going alright.,welcome back glad to see your video pop up atidakin i hope everything is going alright,1
"Idk how you can manage to stay focused while watching horror films but oh well, cheers to you!😅 While we don't know what you're going though irl I hope for your well being. That being the case, I would still like to recommend a film to you if interested, it's called 'Inner Senses (2002) a Hong Kong horror film. Idk if the film is available online or if there are still physical copies for sale, but I watch this on my highschool days and it's one of the horror films that is still stuck to me to this day...",idk how you can manage to stay focused while watching horror films but oh well cheers to you while we dont know what youre going though irl i hope for your well being that being the case i would still like to recommend a film to you if interested its called inner senses a hong kong horror film idk if the film is available online or if there are still physical copies for sale but i watch this on my highschool days and its one of the horror films that is still stuck to me to this day,1
take as much time needed and focus in your healing and regulations. Sending in vigor your way ✨,take as much time needed and focus in your healing and regulations sending in vigor your way,1
Try Pa Siyam,try pa siyam,1
Hope you feel better 🫶,hope you feel better,1
"Dude... Personal Health is WAY more important than YouTube... yeah, you can always come back (When ready, though). And always, your fans will say the same thing... I am an acquaintance to this channel still, I only discovered this channel a few days ago! And, I'm thoroughly enjoying this content! Especially when it comes to the way scarier movies! You always manage to add a tinge of comedy to it, making the viewing of the clips way less scarier! 

Trust me, I suffer from PTSD, Bipolar II, Manic Depression, OCD, ADHD, and Anger Tendencies. I go through a fuck ton of problems in my life, I've even attempted Suicide multiple times back when I was a teenager. But, I've always manged to talk myself out of it. Because of one thing, and it's extremely important in our lives... as long as we have a supporting community of friends and family by our sides, we can usually fight through that blackness.",dude personal health is way more important than youtube yeah you can always come back when ready though and always your fans will say the same thing i am an acquaintance to this channel still i only discovered this channel a few days ago and im thoroughly enjoying this content especially when it comes to the way scarier movies you always manage to add a tinge of comedy to it making the viewing of the clips way less scarier trust me i suffer from ptsd bipolar ii manic depression ocd adhd and anger tendencies i go through a fuck ton of problems in my life ive even attempted suicide multiple times back when i was a teenager but ive always manged to talk myself out of it because of one thing and its extremely important in our lives as long as we have a supporting community of friends and family by our sides we can usually fight through that blackness,1
no problem.. More power to you sir!😊,no problem more power to you sir,1
"@HorrorMine This is a bit of an out-there request, but would you cover Kingdom (2019) at all? It’s one of the best zombie shows out there",horrormine this is a bit of an outthere request but would you cover kingdom at all its one of the best zombie shows out there,1
​ @SamtheMan3014 oh my goodness! Best zombie horror series ever! I still get chills thinking about it 😅,samthemanoh my goodness best zombie horror series ever i still get chills thinking about it,1
"Wow later than usual today.
You could had uploaded it tomorrow?",wow later than usual todayyou could had uploaded it tomorrow,1
 @Keithis2nd  I apologize for my comment on your post… I’m sorry! I’ve deleted it… 😢,keithisnd i apologize for my comment on your post im sorry ive deleted it,1
That's interesting,thats interesting,1
19:13 did anyone know what was the Samurai Demon chanting?,did anyone know what was the samurai demon chanting,1
"Chapter II was so good. It's so eerie, as if anything can happen.  Uncovering the mysterious that shrouded land was the best part of the movie.",chapter ii was so good its so eerie as if anything can happen uncovering the mysterious that shrouded land was the best part of the movie,1
Shout out to fellow year of the pig friends!! 🐖,shout out to fellow year of the pig friends,1
Movie was 10/10. You'd agree if you knew the religion and what goes on with shamanism. Outsiders looking in wouldn't know.,movie was youd agree if you knew the religion and what goes on with shamanism outsiders looking in wouldnt know,1
"i watch this and it 0% scare, ghost could hijack phone and supposedly ancient japanese samurai ghost knowing coordinates is quite funny, he only want fish XD",i watch this and it scare ghost could hijack phone and supposedly ancient japanese samurai ghost knowing coordinates is quite funny he only want fish xd,1
they brought in shamans to LA instead of a priest from the local church? Y'all already know that ghost is a little too strong.,they brought in shamans to la instead of a priest from the local church yall already know that ghost is a little too strong,1
"Honnestly, i really liked this movie. Its interesting how the first half was horror while the second half leaned in supernatural mystery. Tbh id love a streaming type series of the characters especially the two shaman leads",honnestly i really liked this movie its interesting how the first half was horror while the second half leaned in supernatural mystery tbh id love a streaming type series of the characters especially the two shaman leads,1
I just watched the movie on YouTube Shudder----it was fascinating and entertaining and original and tense in some parts.,i just watched the movie on youtube shudderit was fascinating and entertaining and original and tense in some parts,1
"Movie started awesome, I was so interested in it's mystery 
But the moment a ghost movie made our threat ""physical"" it kinda lost the charm. The biggest upside of having supernatural elements is that it's hard to guess what will happen, the moment we have a physical being we get less into a supernatural territory
But still very enjoyable, Choi Min Sik the goat as always",movie started awesome i was so interested in its mystery but the moment a ghost movie made our threat physical it kinda lost the charm the biggest upside of having supernatural elements is that its hard to guess what will happen the moment we have a physical being we get less into a supernatural territorybut still very enjoyable choi min sik the goat as always,1
17:29 Mad use of Free will there,mad use of free will there,1
"That ""Onii-Chan"" came out of nowhere.😂😂😂",that oniichan came out of nowhere,1
17:30 why would you do that bro you cringe the shit out of me,why would you do that bro you cringe the shit out of me,1
"I was anticipated to watch this movie, and once I watched it , I felt disappointed ☹️☹️☹️",i was anticipated to watch this movie and once i watched it i felt disappointed,1
"Personally I like the 2nd half as much as 1st half, the samurai gives off such a raid boss energy, Park's spirit was just a mini boss.",personally i like the nd half as much as st half the samurai gives off such a raid boss energy parks spirit was just a mini boss,1
"The Grandmother's exchange with the samurai has cultural significance. 
The “samurai” or Japanese spirit (or demon/ghost general) is bound by spiritual rules and affected by the traditional Korean shamanistic beliefs, rituals, and power structures. In many traditions, especially Shamanic and folk religions in Korea (and neighboring cultures), there is a belief that ancestral spirits or local deities must be respected, and invading or violent spirits (especially “foreign” ones) must avoid direct confrontation with those guardians. 

The grandmother figure serves as a manifestation of that local sacred order. When she appears, it signals that this sacred order is at play. she is a respected shamanic figure whose spirit carries authority and spiritual power. Ghosts or spirits like the samurai / Anima are bound by spiritual hierarchy, especially in this film’s universe. The character of the grandmother invokes protection and spiritual displacement, a power strong enough to repel or disrupt the samurai’s attacks.",the grandmothers exchange with the samurai has cultural significance the samurai or japanese spirit or demonghost general is bound by spiritual rules and affected by the traditional korean shamanistic beliefs rituals and power structures in many traditions especially shamanic and folk religions in korea and neighboring cultures there is a belief that ancestral spirits or local deities must be respected and invading or violent spirits especially foreign ones must avoid direct confrontation with those guardians the grandmother figure serves as a manifestation of that local sacred order when she appears it signals that this sacred order is at play she is a respected shamanic figure whose spirit carries authority and spiritual power ghosts or spirits like the samurai anima are bound by spiritual hierarchy especially in this films universe the character of the grandmother invokes protection and spiritual displacement a power strong enough to repel or disrupt the samurais attacks,1
"So some folklore stuff about Professor Kim's comment on Foxes and Graves. There's likely there's a mix of Japanese and Korean in the movie, I'm not versed enough to pinpoint what is what but I'll leave something interesting.

So Foxes in particular range from divine messengers of the Gods to bloodthirsty succubi preying on souls in Japanese and Korean beliefs. Now there could be two reasons why foxes and graves are a bad thing. Reason 1 is the gumiho, a Korean fox spirit which is said to wander grave sites to dig up corpses to eat their heart or liver(depends on the story) in order to become human or become more powerful. Another reason and maybe this is why the Professor Kim is confused, might be leaning into Buddhist beliefs(Wu Xing is a Taoist belief mostly) of the goddess Dakini, who in Japanese beliefs would wound up being associated with Inari called Dakiniten. Dakiniten is a corpse eater who worked for Enma's court(the 5th Judge of Naraka), and her foxes are her eyes and ears to find the dead who are still in the mortal realms. It could be that the foxes sensed the spirit of the samurai, intending to retrieve it but likely Gisune's ritual prevents them from bringing him back to Japan.

All in all, if you kinda ignore Exhuma for its horror factor, it kinda makes a really cool supernatural thriller like Ghostbusters or Trese.",so some folklore stuff about professor kims comment on foxes and graves theres likely theres a mix of japanese and korean in the movie im not versed enough to pinpoint what is what but ill leave something interestingso foxes in particular range from divine messengers of the gods to bloodthirsty succubi preying on souls in japanese and korean beliefs now there could be two reasons why foxes and graves are a bad thing reason is the gumiho a korean fox spirit which is said to wander grave sites to dig up corpses to eat their heart or liverdepends on the story in order to become human or become more powerful another reason and maybe this is why the professor kim is confused might be leaning into buddhist beliefswu xing is a taoist belief mostly of the goddess dakini who in japanese beliefs would wound up being associated with inari called dakiniten dakiniten is a corpse eater who worked for enmas courtthe th judge of naraka and her foxes are her eyes and ears to find the dead who are still in the mortal realms it could be that the foxes sensed the spirit of the samurai intending to retrieve it but likely gisunes ritual prevents them from bringing him back to japanall in all if you kinda ignore exhuma for its horror factor it kinda makes a really cool supernatural thriller like ghostbusters or trese,1
"This one definitely stands up there almost as good as THE WAILING for me. WAILING is better but, man, this one was so fun too.",this one definitely stands up there almost as good as the wailing for me wailing is better but man this one was so fun too,1
"Thanks for your work, finally  understood the plot! About the lady-japanese-ghost — the way a broom was placed in her neck reminds of them stucking a katana into the general's neck. Perhaps, one of Japanese sinister burial rituals?",thanks for your work finally understood the plot about the ladyjapaneseghost the way a broom was placed in her neck reminds of them stucking a katana into the generals neck perhaps one of japanese sinister burial rituals,1
I think it was going for the Wailing route and then suddenly turned into anime.,i think it was going for the wailing route and then suddenly turned into anime,1
"50% for one of the best horror films ever??? Nah, your opinion is rancid.",for one of the best horror films ever your opinion is rancid,1
"Yes, and the general felt like a raid boss",yes and the general felt like a raid boss,1
Its actually a yokai called a Tsukugami. They possess household items.,its actually a yokai called a tsukutidakmi they possess household items,1
Excellent movie commentary 👌,excellent movie commentary,1
17:29 HELLO? WHAT WAS THAT?,hello what was that,1
17:30 wtf dawg,wtf dawg,1
There is a similar Indian movie called Kanatara....a very different but yet very stereotypical India movie.,there is a similar indian movie called kanataraa very different but yet very stereotypical india movie,1
"Found this one to be way too boring and the acting sometimes was a bit meh.
The Wailing was way more engaging and better.",found this one to be way too boring and the acting sometimes was a bit mehthe wailing was way more entidakging and better,1
Why this is scary,why this is scary,1
"a cool fun fact is the myth of japanese stakes/markers also existed in my country, which also experienced the japanese colonial rule. Not very popular, but it was something i heard from grandpas i used to hang out with as a child.",a cool fun fact is the myth of japanese stakesmarkers also existed in my country which also experienced the japanese colonial rule not very popular but it was something i heard from grandpas i used to hang out with as a child,1
The random chinese characters written all over her made me laugh,the random chinese characters written all over her made me laugh,1
"honestly i don't care if it was scary or not, it had a good plot and i'm here for it",honestly i dont care if it was scary or not it had a good plot and im here for it,1
"Its not scary at all but the storyline was nice n the actors slayed their characters, but definitely not scary at least for me",its not scary at all but the storyline was nice n the actors slayed their characters but definitely not scary at least for me,1
This movies fucking good bro yall missing out if u havent seen it,this movies fucking good bro yall missing out if u havent seen it,1
This was a cartoon. Ending was goofy.,this was a cartoon ending was goofy,1
I’m glad you covered this one. I feel Ike I can appreciate this story more because of how well you explained things. Thanks.,im glad you covered this one i feel ike i can appreciate this story more because of how well you explained things thanks,1
"It’s somewhat very relatable, even in Indonesia, we believe that during the Japanese occupation, they put all these iron stakes all around the country to create spritual unrest, disturbing fengshui and create division/distrust among people (for example the border between South and North Korea, so they will forever be enemies).

After Exhuma was released, I started hearing some story in Indonesia too, in the Borneo Island, near the border between 3 countries; Malaysia, Indonesia and Brunei. It was told that some developer company wanted to create a resort near the area, but was kept being ‘disturbed’. There was an old, ancient tree located at the center of the area. Locals had already told them not to linger around the tree area, let alone cut the tree, because it was haunted by a malevolent Japanese geisha spirit.

They tried multiple offerings, as far as doing human sacrifices to the tree, yet nothing seemed to worked. One of the shaman they hired told them the tree needed to be cut, if they want to proceed. Strangely enough, the tree was immune to everything (axe, fire, chemicals, etc), either tools were broken or the worker got possessed and died. So they tried the other way; to dig up the tree. Turns out, there was a vertical coffin underneath, chained with iron barbs and difficult to open.

It was a bloody story, as a lot of people died, possessed, even the shamans they tried to hire. Long story short, when the coffin was finally opened, inside was a skeleton with iron stakes, wearing a kimono. Eventually, they managed to poison the tree which made the soil surrounding the area infertile, and also causing the resort project being abandoned. Some speculate maybe due to lack of funds after so many failures, some also said that because the area was practically ‘dead’ and ominous, it wasn’t a good place to be developed anymore.

The rumors told that the geisha was meant to be an entertainment for the Japanese soldiers dispatched there, but somehow tragically killed/being abused to death, so they used her body as a stake. She build resentment over this, making the area unhabitable and haunted. Creepy story.",its somewhat very relatable even in indonesia we believe that during the japanese occupation they put all these iron stakes all around the country to create spritual unrest disturbing fengshui and create divisiondistrust among people for example the border between south and north korea so they will forever be enemiesafter exhuma was released i started hearing some story in indonesia too in the borneo island near the border between countries malaysia indonesia and brunei it was told that some developer company wanted to create a resort near the area but was kept being disturbed there was an old ancient tree located at the center of the area locals had already told them not to linger around the tree area let alone cut the tree because it was haunted by a malevolent japanese geisha spiritthey tried multiple offerings as far as doing human sacrifices to the tree yet nothing seemed to worked one of the shaman they hired told them the tree needed to be cut if they want to proceed strangely enough the tree was immune to everything axe fire chemicals etc either tools were broken or the worker got possessed and died so they tried the other way to dig up the tree turns out there was a vertical coffin underneath chained with iron barbs and difficult to openit was a bloody story as a lot of people died possessed even the shamans they tried to hire long story short when the coffin was finally opened inside was a skeleton with iron stakes wearing a kimono eventually they managed to poison the tree which made the soil surrounding the area infertile and also causing the resort project being abandoned some speculate maybe due to lack of funds after so many failures some also said that because the area was practically dead and ominous it wasnt a good place to be developed anymorethe rumors told that the geisha was meant to be an entertainment for the japanese soldiers dispatched there but somehow tragically killedbeing abused to death so they used her body as a stake she build resentment over this making the area unhabitable and haunted creepy story,1
"this movie really gave me chill down my spine. and i assure you sometimes, scary is not about jumpscare or any ghostly activity. the music itself already makes me sweat on my seat. maybe why i found this movie so eerie is because it is really happened to us, asian. i have cousin that always sick but doctor cant find the root of her sickness. she always said that she saw our late grandpa walking around their house. after months of digging, the one that make her sick is not my late grandpa. but the one inside him before. the thing want a next medium. there is also a story where my other cousin also having an unknown sickness. she always felt heavy.  when they asked someone with ""specials"" gift, he said that my cousin late grandma  spirit on her dad side been clinging onto her. hugging her from from the back and sit on her shoulder. for me this movie is as strong as 8/10",this movie really tidakve me chill down my spine and i assure you sometimes scary is not about jumpscare or any ghostly activity the music itself already makes me sweat on my seat maybe why i found this movie so eerie is because it is really happened to us asian i have cousin that always sick but doctor cant find the root of her sickness she always said that she saw our late grandpa walking around their house after months of digging the one that make her sick is not my late grandpa but the one inside him before the thing want a next medium there is also a story where my other cousin also having an unknown sickness she always felt heavy when they asked someone with specials gift he said that my cousin late grandma spirit on her dad side been clinging onto her hugging her from from the back and sit on her shoulder for me this movie is as strong as,1
"im not sure why, when we got to the Samurai section and how big he is, kind of makes me wish we had a Modern-day remake/reimagining of Daimajin",im not sure why when we got to the samurai section and how big he is kind of makes me wish we had a modernday remakereimagining of daimajin,1
Word bearer when they have nothing to do in downtime,word bearer when they have nothing to do in downtime,1
"17:29 ahhhhhhhhhhhhh my ear, it's burning",ahhhhhhhhhhhhh my ear its burning,1
This movie is less scary than just awesome. Like a supernatural adventure.,this movie is less scary than just awesome like a supernatural adventure,1
Loved this movie. I wish there were a series of movies about this team.,loved this movie i wish there were a series of movies about this team,1
"Indeed, the 2nd half of Exhuma felt as if it was a live-action of a certain anime.",indeed the nd half of exhuma felt as if it was a liveaction of a certain anime,1
"9:50 in Thailand we have the same type of thing, cause when we were younger. We were told that, if you see a snake do not kill or do anything to it: due to the evil spirit will take form or a reptile.",in thailand we have the same type of thing cause when we were younger we were told that if you see a snake do not kill or do anything to it due to the evil spirit will take form or a reptile,1
22:27 for the sake of understanding the movie we learned history 😆,for the sake of understanding the movie we learned history,1
22:27 for the sake of understanding the movie we learned history 😆,for the sake of understanding the movie we learned history,1
17:29 that came out of nowhere! 🤣🤣🤣 my sides hurt,that came out of nowhere my sides hurt,1
