komentar,clean,sentimen
As the guardian of  site the anima's spirit is likely bound to the grave so moving the coffin would drive it to return to the site.....they dropped the coffin while pulling out & waking the sleep anima and snake demon was guarding the anima ....wht a killing mind bowling scene ...need another EXHUMA wntd to see Gisune onmyouji 🐺 story portrayal 😅🥲,as the guardian of site the animas spirit is likely bound to the grave so moving the coffin would drive it to return to the sitethey dropped the coffin while pulling out waking the sleep anima and snake demon was guarding the anima wht a killing mind bowling scene need another exhuma wntd to see gisune onmyouji story portrayal,1
Such a nice explanation of the Korean movie 👍 I just loved your explanation style you have  explained every point so clearly. Nice Job🙌,such a nice explanation of the korean movie i just loved your explanation style you have explained every point so clearly nice job,1
Photos ke jagah video clips use krte to jada maza ata,photos jatidakh video clips use krte to jada maza ata,1
How beautifully he explained I watched it till end but some things I also didn't understand but outstanding,how beautifully he explained i watched it till end but some things i also didnt understand but outstanding,1
Where to watch this movie,where to watch this movie,1
"Isiliye hum hindu darmn main marne kya bath insan ko jaladiya jatha hain 
Jadatar vutia movies main jalane par hi atma ko santi mjlta hain😁",isiliye hum hindu darmn main marne kya bath insan ko jaladiya jatha hain jadatar vutia movies main jalane par hi atma ko santi mjlta hain,1
Bohat hi achha tha thank u,bohat hi achha tha thank u,1
Where to watch,where to watch,1
Why grandpa ghost was asking to open the window,why grandpa ghost was asking to open the window,1
"Desh bhakti in a horror movie.😂😂😂😂
Btw, Kitsune means a nine tailed fox,in jap's folklore.",desh bhakti in a horror moviebtw kitsune means a nine tailed foxin japs folklore,1
India me Konsa naam h bhai movie ka 😢,india me konsa naam h bhai movie ka,1
So freaking movie❤,so freaking movie,1
Tumhara awaj @loginion se kafi match hota hai 😅😅,tumhara awaj loginion kafi match hota hai,1
Bhai kya hindi me available hai ye movie,bhai kya hindi me available hai ye movie,1
please explain Omen movie,please explain omen movie,1
Bahut acha explain Kiya hai.very good sir,bahut acha explain kiya haivery good sir,1
Grandpa needs a raise!💀,grandpa needs a raise,1
Kaun kaun sivam bhai ka video dekh kar edhar aye ho (like),kaun kaun sivam bhai ka video dekh kar edhar aye ho like,1
Bro same to same like logination jai si awaj he,bro same to same like logination jai si awaj he,1
Where can i see this movie??,where can i see this movie,1
35:27 ghanta 😂😂😂,ghanta,1
Is he logion,is he logion,1
Gitsune was literally the clever fox...,gitsune was literally the clever fox,1
Where can we see this movie,where can we see this movie,1
Rod's konsa kaam krte hai Jo Korea me dafnaye Gaye???  Please koi batao,rods konsa kaam krte hai jo korea me dafnaye tidakye please koi batao,1
I am shocked no one commented that the guy speaking is loginion 😢😂😂,i am shocked no one commented that the guy speaking is loginion,1
Where I can watch this  movie?,where i can watch this movie,1
I loved the two plotline of this film and how they got interconnected in the end,i loved the two plotline of this film and how they got interconnected in the end,1
bas aise h longs videos k liye m last 5 years se iss channel se juda hua hu / great explained,bas aise h longs videos k liye m last years iss channel juda hua hu great explained,1
Nice story🙏🙏🙏🙏,nice story,1
"Its 2024 
Aur abhi bhi still picture se explain?",its aur abhi bhi still picture explain,1
Kon kon abhi shivam is on ke channel se comment padhke aaya hai😂,kon kon abhi shivam is on channel comment padhke aaya hai,1
"Ye baat
This is the comment that I am searching for😂 
Tumne bhi Shivam bhai ke comment section se kisi comment ko padhakar hi yahan per aaye Ho Na",ye baatthis is the comment that i am searching for tumne bhi shivam bhai comment section kisi comment ko padhakar hi yahan aaye ho na,1
Main,main,1
Same bro,same bro,1
grandpa woke up and chose violence 💀,grandpa woke up and chose violence,1
Thank god that chiken is safe 😅,thank god that chiken is safe,1
Very nice work . Keep it up sir,very nice work keep it up sir,1
"Where can I watch this movie. please, some help!!!",where can i watch this movie please some help,1
I believe in fungshui and i have studied fungshui too but trust me I ain't crazy rich.. probably because I don't use it in daily life but mannn i think I should now 🤣,i believe in fungshui and i have studied fungshui too but trust me i aint crazy rich probably because i dont use it in daily life but mannn i think i should now,1
Full movie kaha dekh sakte hai?,full movie kaha dekh sakte hai,1
bhaiya aap loginion ho kya??,bhaiya aap loginion ho kya,1
"I finally understand the whole story😭😭 for the first time in my life I watched this much good explanation of any movie, I love this ❤❤❤❤❤",i finally understand the whole story for the first time in my life i watched this much good explanation of any movie i love this,1
After watching this movie I was really feeling weird for two days and the seen where they dig out the coffin that whole part was something else and they said that the actress literally summoned a real spirit and every one was feeling weird for some days I got goose bumps so many times while watching but this movie is really amazing,after watching this movie i was really feeling weird for two days and the seen where they dig out the coffin that whole part was something else and they said that the actress literally summoned a real spirit and every one was feeling weird for some days i got goose bumps so many times while watching but this movie is really amazing,1
Logi ji behad sare channel chala rahe ho,logi ji behad sare channel chala rahe ho,1
"Please explain the movie ""Vina : sebelum 7 hari""🙏🏻❤️
You are the only hope to clear out my doubts on the movie",please explain the movie vina hariyou are the only hope to clear out my doubts on the movie,1
Sala baba ji ka ghatna samjh nai aaraha,sala baba ji ka ghatna samjh nai aaraha,1
One of the best explained movie...great work buddy.,one of the best explained moviegreat work buddy,1
That was sooooo sooo amazing. I really enjoyed it,that was sooooo sooo amazing i really enjoyed it,1
How can I see it in hindi,how can i see it in hindi,1
Vina movie explanation please🙏,vina movie explanation please,1
japanese general ka body agar 500 saal  ka hai to wo kharap kyun nehin hua or wo gisune ko kaise mila??,japanese general ka body atidakr saal ka hai to wo kharap kyun nehin hua or wo gisune ko kaise mila,1
Plz explain vina. Its an indonasian horror movie released on 8th May 2024.🙂,plz explain vina its an indonasian horror movie released on th may,1
One more theory. As if someone wanted this to happen. Some divine power played out this series of events.,one more theory as if someone wanted this to happen some divine power played out this series of events,1
Spine is backbone of any person. Killing or injuring the spine means disabling that person. What a nice comparison.,spine is backbone of any person killing or injuring the spine means disabling that person what a nice comparison,1
"Literally i was watching this movie today and you couldn't believe that the lightening and thunderstorm (as it was raining today) synched with movie scenes i got goosebumps because of that, i thought that some spirit have been called near my home because of the chantings. Eerie moment for me. How are you feeling now? I have watched it on tv , btw the ladysnake was very creepy",literally i was watching this movie today and you couldnt believe that the lightening and thunderstorm as it was raining today synched with movie scenes i got goosebumps because of that i thought that some spirit have been called near my home because of the chantings eerie moment for me how are you feeling now i have watched it on tv btw the ladysnake was very creepy,1
bhaiiya taoism  pay video lau,bhaiiya taoism pay video lau,1
Bana lo next vedio,bana lo next vedio,1
"Bro Anyone notice that (Enma) a katana Which Current Weilder is (Zoro) in (OnePiece) And also it's a Crused Sword 
Blade in the anime. (Amesome) Zoro is Everywhere
⚔⚔⚔⚔⚔⚔⚔⚔",bro anyone notice that enma a katana which current weilder is zoro in onepiece and also its a crused sword blade in the anime amesome zoro is everywhere,1
🤯,,1
please explain flower of  evil 😊,please explain flower of evil,1
Where we can watch this??,where we can watch this,1
Korean hai kodean nahi,korean hai kodean nahi,1
Was just thinking where have I heard this voice. Then i viewed the shorts on this page😂,was just thinking where have i heard this voice then i viewed the shorts on this page,1
"Isko Kahan se dekh sakte
 hai",isko kahan dekh sakte hai,1
"Qi,chi are type of spiritual energy or inner energy",qichi are type of spiritual energy or inner energy,1
I watch this movie bt your explanation is super ❤❤❤❤❤❤,i watch this movie bt your explanation is super,1
"Shamanism is also part of indian hinduism
Shiva is the greatest lord and shamanism is a system created from the knowledge of shiva",shamanism is also part of indian hinduismshiva is the greatest lord and shamanism is a system created from the knowledge of shiva,1
Is it available in English or Hindi?,is it available in english or hindi,1
Where to watch??? Anyone help,where to watch anyone help,1
Movie goes from good better best,movie goes from good better best,1
what is your anime explanation        account name,what is your anime explanation account name,1
"22:55 kitsune is a Nine Tailed Fox. In KOREA it is known as Kumiho. It's not a monster, it's an Clever Ichchadhari Vixen.",kitsune is a nine tailed fox in korea it is known as kumiho its not a monster its an clever ichchadhari vixen,1
I guess the monk took out the liver of the summurai and placed the iron stack in that place so he take out liver of others too,i guess the monk took out the liver of the summurai and placed the iron stack in that place so he take out liver of others too,1
Apne kha se dekhi ye movie  ott me nhi mili,apne kha dekhi ye movie ott me nhi mili,1
Study kr k thak gai isliye mind fresh kri hu😁,study kr k thak tidaki isliye mind fresh kri hu,1
Yify website,yify website,1
"Kitsune's are not evil but they have healing powers, usually they're afraid of humans but if they fall in love they leave the forest and follow their love",kitsunes are not evil but they have healing powers usually theyre afraid of humans but if they fall in love they leave the forest and follow their love,1
Well there are a lot of other type of fox demons i guess gisune was also one,well there are a lot of other type of fox demons i guess gisune was also one,1
Yeah naruto had 9 tailed fox and k drama about 9 tailed foxes... The folklore is almost the same ❤ they are considered holy spirits who guard forest,yeah naruto had tailed fox and k drama about tailed foxes the folklore is almost the same they are considered holy spirits who guard forest,1
Where to watch it???,where to watch it,1
Please tell me where I can watch this movie,please tell me where i can watch this movie,1
After killing many people and experiencing the rage and killing intent for soo long a weapon will gain consciousness like a spirit or a living person.. as per Japanese stories I've read.. I don't know how much of it is truth tho,after killing many people and experiencing the rage and killing intent for soo long a weapon will tidakin consciousness like a spirit or a living person as japanese stories ive read i dont know how much of it is truth tho,1
this happens for real even now... (I didn't know all about this until 2023 when one of my know 23-year-olds died due to the same reason (,this happens for real even now i didnt know all about this until when one of my know yearolds died due to the same reason,1
That's why orry calls himself liverrrr ??,thats why orry calls himself liverrrr,1
Bro movies keha dekhi,bro movies keha dekhi,1
Pls explain the first omen movie pls pls pls😢😢,pls explain the first omen movie pls pls pls,1
Now korea will prosper and become superpower,now korea will prosper and become superpower,1
You should’ve explained in English,you shouldve explained in english,1
Please the sadness movie ke bareme explain kijiye,please the sadness movie bareme explain kijiye,1
Where can we watch this,where can we watch this,1
Aapse achha ab koi nhi samjha sakta itna samjhaagya jitna to movie dekh kr bhi nhi samjhh aata,aapse achha ab koi nhi samjha sakta itna samjhaagya jitna to movie dekh kr bhi nhi samjhh aata,1
"Not even watched the movie yet , before explanation dekh li spoilers 😂❤",not even watched the movie yet before explanation dekh li spoilers,1
Please explain the 8 show … it’s on Netflix,please explain the show its on netflix,1
"one question, what is the meaning of the scene when the old host at the temple was standing on Bong-Gil's chest and then Bong-Gil scribbles something on the floor board with his finger?",one question what is the meaning of the scene when the old host at the temple was standing on bonggils chest and then bonggil scribbles something on the floor board with his finger,1
In Asia mostly in Korea and Japan eating someone Liver means to make their Spirit and soul more powerfull.,in asia mostly in korea and japan eating someone liver means to make their spirit and soul more powerfull,1
How to watch this movie,how to watch this movie,1
Where I can watch??,where i can watch,1
Kim go eun and lee do hyun nailed it,kim go eun and lee do hyun nailed it,1
Fengsui and aise hei topics par aur videos banaiye,fengsui and aise hei topics par aur videos banaiye,2
main kai movies dekhi h jo explain ki gyi hai par jo aapka tarika hai bolne samjhane ka like a PHD professor i impress... bolte sab h par sahi bolne ka tarika kam logo ke pass hota hai... mai bhi khus hu randomly frist choice aapke video ko de di thi... aise hi karte ho aaj ke wat m logo likhna bolna padna psnd nhi hai par aapke samjhane ka tarike se pta chal hai life ke experience se knowledge achaa gain kia huaa hai .. Dhanyawad aaj ka din achaa banane ke liye... kyuki kafi waqt baad koi sahi movie dekhne ko mili hai...,main kai movies dekhi h jo explain ki gyi hai par jo aapka tarika hai bolne samjhane ka like a phd professor i impress bolte sab h par sahi bolne ka tarika kam logo pass hota hai mai bhi khus hu randomly frist choice aapke video ko de thi aise hi karte ho aaj wat m logo likhna bolna padna psnd nhi hai par aapke samjhane ka tarike pta chal hai life experience knowledge achaa tidakin kia huaa hai dhanyawad aaj ka din achaa banane liye kyuki kafi waqt baad koi sahi movie dekhne ko mili hai,1
Can you please make an explanation video on horror/thriller 'MARTYRS' original version movie. 😊,can you please make an explanation video on horrorthriller martyrs original version movie,1
"Ye sb kuch bhi Jo isme hn why this sane as pahadi culture and spirit,  ghost bhot nrml hn pahadio k lie",ye sb kuch bhi jo isme hn why this sane as pahadi culture and spirit ghost bhot nrml hn pahadio k lie,1
Your voice is similar to Loginion,your voice is similar to loginion,1
Is this movie is available in Hindi dubbed. ??,is this movie is available in hindi dubbed,1
Are u loginon,are u loginon,1
"I don't know if it is a translation mistake but when I watched the movie it was:- ""The fox has broken the tiger's spine."" Tbh this statement fitted more according to the situation they were dealing with.",i dont know if it is a translation mistake but when i watched the movie it was the fox has broken the tigers spine tbh this statement fitted more according to the situation they were dealing with,1
"It's not park it's bbhak

It's not kim sang deok it's gim sang dok
It's not young geun it's yong gun


no hate, just correcting",its not park its bbhakits not kim sang deok its gim sang dokits not young geun its yong gunno hate just correcting,1
"I just came for to make a comment on this movie: i watched it few weeks ago, that movie was one of best South Korean Horror Thriller movie....must watch ✌️",i just came for to make a comment on this movie i watched it few weeks ago that movie was one of best south korean horror thriller moviemust watch,1
Nice explained and well clear all the doubts😊,nice explained and well clear all the doubts,1
"""Ghanta kuch nhi pata"" got me",ghanta kuch nhi pata got me,1
Pagoda is used for meditation in Buddhism and it has a lot of positive power so no negative power comes,pagoda is used for meditation in buddhism and it has a lot of positive power so no netidaktive power comes,1
wdym I watched it twice already,wdym i watched it twice already,1
Keel going make long videos like this it is great,keel going make long videos like this it is great,1
Where can i find this movie???,where can i find this movie,1
But why is the monster so huge and why didn't his body got decompresed even after 500 years,but why is the monster so huge and why didnt his body got decompresed even after years,1
Onna❎orochimaru✅😂,onnaorochimaru,1
I need that separate video 🥹,i need that separate video,1
Movie kaun se ott platform per hai,movie kaun ott platform hai,1
Korean movie serial best hote h kor hahi na kahi unki koi matlab hota h 👍,korean movie serial best hote h kor hahi na kahi unki koi matlab hota h,1
"Dono line boli thi
Alag alag scenes me",dono line boli thialag alag scenes me,1
"ayo, he isnt korean, and not all people outside of Korea know the pronounications...[no hate] just correcting",ayo he isnt korean and not all people outside of korea know the pronounicationsno hate just correcting,1
​ @Avika72 exactly 💯,avikaexactly,1
" @Avika72  but its not bad improving once knowledge, right?",avika but its not bad improving once knowledge right,1
Jyada mat bano samjhe..jab wo log humari name galat pronounce krte hain tab unko bolte kyu nahi ..koreaboo,jyada mat bano samjhejab wo log humari name tidaklat pronounce krte hain tab unko bolte kyu nahi koreaboo,1
 @Saturnring1  the creator aint angry dumpsters like you are 🤣🤣,saturnring the creator aint angry dumpsters like you are,1
It's not that deep u gotta chill,its not that deep u gotta chill,1
Apple TV,apple tv,1
Dramacool,dramacool,1
Where can I watch this movie?  Please reply,where can i watch this movie please reply,1
"""Ujle se ajeeb chehre wala aadmi"" was personal 😂",ujle ajeeb chehre wala aadmi was personal,1
Ap to sukuna ka fan ho naa,ap to sukuna ka fan ho naa,1
Where can I watch this ?,where can i watch this,1
please make a video on human head snake body,please make a video on human head snake body,1
Those grave robbers really had that story or it just...,those grave robbers really had that story or it just,1
Bar bar ho confused bolte ho nah wo bohot irritating hain,bar bar ho confused bolte ho wo bohot irritating hain,1
"I have watched this movie and understood only 70%  part and  wondering why is the hype so ? But  after your explanation, i am speachless, i mean it's frikkin brilliant the movie and your explanation both , i am new to your channel,😊 Mahadev bless you,  keep shining with your talent",i have watched this movie and understood only part and wondering why is the hype so but after your explanation i am speachless i mean its frikkin brilliant the movie and your explanation both i am new to your channel mahadev bless you keep shining with your talent,1
"wow, this was an amazing watch, i really loved the storyline's way of explanation. it just randomly popped on my feed cuz i sometimes watch haunting tube, but this had set the bar high for my future expectations from this channel and its other videos
😀",wow this was an amazing watch i really loved the storylines way of explanation it just randomly popped on my feed cuz i sometimes watch haunting tube but this had set the bar high for my future expectations from this channel and its other videos,1
why did samurai wish to eat sweet fish and melons?,why did samurai wish to eat sweet fish and melons,1
"I think geomancer did a great work, my heart was totally in messed when he was digging there....",i think geomancer did a great work my heart was totally in messed when he was digging there,1
BUT BRO FOX MONSTER KOREA KO HATE KYU KARTA THA BHAI,but bro fox monster korea ko hate kyu karta tha bhai,1
Le samurai: one plate liver rice parcel😅😂😂,le samurai one plate liver rice parcel,1
Video k sath upload kiya karo vroo 😢,video k sath upload kiya karo vroo,1
"Bhai movie kahan dekhe, yeh toh bata dete !!!!!",bhai movie kahan dekhe yeh bata dete,1
Please make a video on Revenant. It is also a Korean horror web series. You will definitely like the series. Please make a video on it as well.,please make a video on revenant it is also a korean horror web series you will definitely like the series please make a video on it as well,1
As an Indian Hindu  the Theory of 5 elements is pretty easy to understand.,as an indian hindu the theory of elements is pretty easy to understand,1
Auna jaisa sch me kch hota hai kya,auna jaisa sch me kch hota hai kya,1
After watching this explanation still  want to watch this masterpiece ❣️👌,after watching this explanation still want to watch this masterpiece,1
Damn grandpa was Ghosted for a century 🤣🤣,damn grandpa was ghosted for a century,1
😂😂😂😂yeah,yeah,1
It was a historical context of the regional appetite. The east Japan samurai eat melon while the west Japan samurai choose sweet fish. During the Korean war between Korea and Japan. It was west Japan that participated. So the oni/anima/dokkaebi was testing Hwarim,it was a historical context of the regional appetite the east japan samurai eat melon while the west japan samurai choose sweet fish during the korean war between korea and japan it was west japan that participated so the onianimadokkaebi was testing hwarim,1
With sweetfish manchurian,with sweetfish manchurian,1
"we should  not mix our traditions with something else and alter it.Actually, in our early traditions every form of nature is worshipped without making any elements out of it",we should not mix our traditions with something else and alter itactually in our early traditions every form of nature is worshipped without making any elements out of it,1
lekin Wood kabse 5 elements me add ho gya?,lekin wood kabse elements me add ho gya,1
"​ @seemaneemwal4989 
Wood is a combination of earth and water 
Metal is a combination of fire and earth 
So everything is kind of connected.",seemaneemwalwood is a combination of earth and water metal is a combination of fire and earth so everything is kind of connected,1
" @seemaneemwal4989  5 elements are considered basic and fundamental elements, of course there will be more complex substances.",seemaneemwal elements are considered basic and fundamental elements of course there will be more complex substances,1
" @seemaneemwal4989   exactly, those 5 elements are from taoism and not in hindu philosophies",seemaneemwal exactly those elements are from taoism and not in hindu philosophies,1
"Panchatava 
Prithvi(earth)
Pavan(air)
Jal(water)
Agni( fire)
Nabh( sky)",panchatava prithviearthpavanairjalwateragni firenabh sky,1
True,true,1
And Also isarel is your father😂,and also isarel is your father,1
"​ @Alysk11 just like arab
Saar we are real Arab Saar we are not Indian not converted🐖🐗🐷🐽",alyskjust like arabsaar we are real arab saar we are not indian not converted,1
"Taoism , Buddhism, shintoism all are religions related to our sanatan dharma , they are closely linked dr",taoism buddhism shintoism all are religions related to our sanatan dharma they are closely linked dr,1
Name the elements,name the elements,1
I believe those rods were the reason why Korea got  divided into two halves one being north and south,i believe those rods were the reason why korea got divided into two halves one being north and south,1
Going to watch this this Saturday ✨,going to watch this this saturday,1
Strangers from hell korean drama ki explanation video banaiye please.. the best psychological horror drama,strangers from hell korean drama ki explanation video banaiye please the best psychological horror drama,1
Exhuma movie are available on which website,exhuma movie are available on which website,1
"This is an amazing movie... 
Such interesting concepts! 
They have known how to depict the ancient folklore and traditions.
Wow!
Thanks for the in-depth explanations!",this is an amazing movie such interesting concepts they have known how to depict the ancient folklore and traditionswowthanks for the indepth explanations,2
"Ur explanation is too good 
Thank you ❤",ur explanation is too good thank you,1
"Ex-huma ❌️
Aah-jumma ✅️",exhuma aahjumma,1
Best movie explaining award goes to logi bhai ❤😊,best movie explaining award goes to logi bhai,1
"You should do a review on the series ""revenant"" , an amazing horror korean drama ,",you should do a review on the series revenant an amazing horror korean drama,1
Aisa hi video or dailya na bht acha lagta hai 😮😮,aisa hi video or dailya na bht acha lagta hai,1
Why everyone did chutiapa 🤣🤣🤣🤣..🤣🤣🤣🤣🤣,why everyone did chutiapa,1
Bechare deshbhakt logo ko chor naam de diya.,bechare deshbhakt logo ko chor naam de diya,1
