komentar,clean,sentimen
"Jepang sampai hari ini masih di masa kekaisaran. Sekarang era Reiwa, Kaisar Naruhito. 
Shogun itu jenderal dan juga pemimpin tertinggi Jepang di era keshogunan. Saat itu Kaisar diasingkan dan kepemimpinan Jepang diambil dan dikuasai sepenuhnya oleh Shogun.
Daimyo itu mirip kayak Gubernur, Bupati dan Lurah di Indonesia, ada tingkatannya sesuai luas wilayah yg dia kuasai. Kalau Samurai itu ya sederhananya kayak TNI, pasukan militer bersenjata. Ada tingkatannya juga. Ada Samurai biasa, ada juga Samurai bangsawan.",jepang kekaisaran era reiwa kaisar naruhito shogun jenderal jutidak pemimpin tertinggi jepang era keshogunan kaisar diasingkan kepemimpinan jepang diambil dikuasai sepenuhnya shogundaimyo kayak gubernur bupati lurah indonesia tingkatannya sesuai luas wilayah yg kuasai samurai ya sederhananya kayak tni pasukan militer bersenjata tingkatannya jutidak samurai jutidak samurai bangsawan,2
kita yang dijajah 3 tahun aja masih kerasa traumanya apalagi mereka yang lebih lama,dijajah aja kerasa traumanya,1
"Wajar sih, 35 tahun dijajahnya. Pedih betul pasti.",wajar sih dijajahnya pedih,1
kalo ngerti sejarah pasti tau seberapa ngeri nya mereka,kalo ngerti sejarah tau ngeri nya,1
"Coba baca sejarahnya benar2 sangat kelam sekali, Jepang itu negara paling kejam dan jahanam saat perang, Indonesia hanya 3 tahun aja luar biasa penderitaan apalagi Korea, ngga heran Korea sampai sekarang masih sering memasukkan sejarah kelam mereka dalam drama atau film, Karena Jepang sendiri tidak mengakui kekejaman mereka dimasa penjajahan.",coba baca sejarahnya santidakt kelam jepang netidakra kejam jahanam perang indonesia aja penderitaan korea ngtidak heran korea memasukkan sejarah kelam drama film jepang tidak mentidakkui kekejaman dimasa penjajahan,1
"Kejem banget soalnya, dan jengkel juga cz Jepang seperti mau menghapus sejarah kelam yg dilakukan bangsa mereka dahulu. Bukannya mengakui tp malah denial, kan kzl",kejem banget jengkel jutidak cz jepang menghapus sejarah kelam yg bangsa mentidakkui tp denial kzl,1
ngebuka sendiri bang,ngebuka bang,1
" @asroamrin-lj6dc  oh, jadi petinya dicabut dari tanah trus otomatis silumannya bangkit ya?
Ga kayak peti yang pertama itu.",asroamrinljdc oh petinya dicabut tanah trus otomatis silumannya bangkit yatidak kayak peti,1
Film bukan serem tapi ngeri klo gw yg rasain,film bukan serem ngeri klo gw yg rasain,1
"Thanks, Rasyid, atas in-depth reviewnya yg mmg perlu buat aku yg masih blm jelas soal detil2 ceritanya. Dgn reviewmu aku jadi lbh paham apa yg mau disampaikan filmnya. Nah, yg jadi pertanyaanku yg ndak kejawab di reviewmu ini, org2 Korea di foto lama yg dibilang penjarah makam tapi ternyata bukan itu pada ngapain dgn pasak2 besi warisan mrk yg ada di biara itu? Apa yg sebenernya mrk lakuin dulu itu? Mrk kayaknya mmg bukan menjarah makam. Terus mrk sebenernya ngapain kalo gitu? Apakah mrk para pengubur kakeknya Park atau apa? Soalnya kalo dari narasi filmnya, mrk ini org2 nasionalis yg cinta tanah air mrk, Korea. Tugas penting apa sebenarnya yg sdh mrk lakuin utk Korea? Bagi pembaca komen yg paham, tlg dijelasin ya, please. Asli aku kurang paham dgn narasi patriot2 Korea ini. Aku ndak ngerti korelasinya dgn cerita filmnya.",thanks rasyid indepth reviewnya yg mmg yg blm detil ceritanya dgn reviewmu lbh paham yg filmnya yg pertanyaanku yg ndak kejawab reviewmu org korea foto yg dibilang penjarah makam bukan ntidakpain dgn pasak besi warisan mrk yg biara yg sebenernya mrk lakuin mrk kayaknya mmg bukan menjarah makam mrk sebenernya ntidakpain kalo gitu mrk pengubur kakeknya park kalo narasi filmnya mrk org nasionalis yg cinta tanah air mrk korea tutidaks yg sdh mrk lakuin utk korea pembaca komen yg paham tlg dijelasin ya please asli paham dgn narasi patriot korea ndak ngerti korelasinya dgn cerita filmnya,1
akhirnya terjawab sudah karena udah nonton 2 kali tapi masih no clue wkwkwkwk,terjawab udah nonton kali no clue wkwkwkwk,1
Naaaaah ! Segmen ini nih yg ku tunggu2.....,naaaaah segmen nih yg ku tunggu,1
Stop dlu ah... Aku besok mau nonton soal e... Ntar balik lgi ya bang hehe,stop dlu ah besok nonton e ntar lgi ya bang hehe,2
KONTEN INI SUPER DUPER MEMBANTU. thanks a lot rasyid dan cinecrib,konten super duper membantu thanks a lot rasyid cinecrib,1
Aaaaaa... Kak Rasyid kalau menjelaskan Gak pernah minus yah.  Thank you. Thank you. Thank you!,aaaaaa kak rasyid tidakk minus yah thank you thank you thank you,1
After watchingnya masih serem the wailing 😱,after watchingnya serem the wailing,1
"Menurutku bakalnada Exhuma 2, karna ada vision para pemeran nya di liatin kalo mereka mati dibunuh saat liat Hantu jepang berubah jadi api pertama kali muter-muter diatas mereka.. makanya dukun cewe & bapak fengshui masih parno dan lukanya masih ngerembes.. nggk semudah itu wiruyama musnah gitu aja pasti dia bakal balik lagi 😢",menurutku bakalnada exhuma karna vision pemeran nya liatin kalo mati dibunuh liat hantu jepang berubah api kali mutermuter diatas dukun cewe fengshui parno lukanya ngerembes nggk semudah wiruyama musnah gitu aja,1
"Gile, bisa nangkep metaforanya.. rispek bang Rasyid! (gw menjura kyk Hwa Rim di gudang nih)",gile nangkep metaforanya rispek bang rasyid gw menjura kyk hwa rim gudang nih,1
"Wah ada spoiler ya bang?
Simpen dulu deh,balik lagi kalo udah nonton😊",spoiler ya bangsimpen dehbalik kalo udah nonton,1
"Kalo pnh baca ato tau soal real fengshui,bazi,5 element bakal ngerti si plot utamanya kenapa. Soal fengshui kuburan itu bneran ada. Keren bgt lah! 8,5/10",kalo pnh baca ato tau real fengshuibazi element ngerti si plot utamanya fengshui kuburan bneran keren bgt,2
apa cuma gw yg suka spoilernya dulu setelah itu gw baru nonton full biar ga telmi..😁😁😁,gw yg suka spoilernya gw nonton full biar tidak telmi,2
Baju zirah hantu jepang nya kyk zirah nya shogun ya ??,baju zirah hantu jepang nya kyk zirah nya shogun ya,1
Ada yang bilang nure onna tuh segel makamnya jendral,bilang nure onna tuh segel makamnya jendral,1
"ada yg kelewat lom lu bahas bang, ditempat lain juga gak dibahas, Kenapa malem2 peti mati Jenderal tiba2 jebol dan keluar pdhal udah di kasih ketan dan darah kuda ditambah petinya juga diiket kawat berduri, itu yg msh bikin penasaran. 

Tapi gw punya teori juga soal itu, kayanya nih.. peti mati kakek Park bukan cuma digunakan buat nutupin kuburan Si Jenderal tapi dijadiin segel juga buat peti mati Si Jenderal itu. Jadi walopun peti mati Si Jenderal gak diangkat dari kuburnya sama Kim Sang Duk cs, kayanya itu Jenderal tetep jebol juga alias tetep keluar juga saat lewat tgh malam krn :
1. Segelnya udah kebuka (peti mati Kakek Park diangkat) 
2. Waktunya dia cari makan (saat lewat tengah malem), 

Gitu sih teori sotoy gw bang 😄 Btw, gw udah 4x nonton film ini, nonton sendiri 2x yg 2x lagi diajak temen hahaaa",yg kelewat lom lu bahas bang ditempat jutidak tidakk dibahas malem peti mati jenderal jebol pdhal udah kasih ketan darah kuda ditambah petinya jutidak diiket kawat berduri yg msh bikin penasaran gw teori jutidak kayanya nih peti mati kakek park bukan nutupin kuburan si jenderal dijadiin segel jutidak peti mati si jenderal walopun peti mati si jenderal tidakk diangkat kuburnya kim sang duk cs kayanya jenderal tetep jebol jutidak alias tetep jutidak tgh malam krn segelnya udah kebuka peti mati kakek park diangkat cari makan tentidakh malem gitu sih teori sotoy gw bang btw gw udah x nonton film nonton x yg x diajak temen hahaaa,1
Jd peti yg dikubur vertikal itu isinya jenazah prajurit jepang y? Apa hubungannya dgn keluarga park??,jd peti yg dikubur vertikal isinya jenazah prajurit jepang y hubuntidaknnya dgn keluartidak park,1
ok,ok,1
"Bang, ular berkepala kunti itu semacam segel untuk kuburannya, seperti kata abang, nambah nambahin kutukan juga, penggali kubur yg motong segel/leher ularnya jd kena penyakit aneh/kutukan",bang ular berkepala kunti segel kuburannya abang nambah nambahin kutukan jutidak pengtidakli kubur yg motong segelleher ularnya jd kena penyakit anehkutukan,0
"Mantap Bang Rasyid, clear bgt",mantap bang rasyid clear bgt,2
Itu mereka patriot korea yg kerjaannya nyabut pasak besi yg ditanem jepang di seluruh semenanjung korea,patriot korea yg kerjaannya nyabut pasak besi yg ditanem jepang semenanjung korea,1
" @mengskar  Nah, pasak2 yg ditanem Jepang itu fungsinya buat apa? Semacam segel atau kunci atau apa kalo menurut sampeyan? Buat apa2 para patriot Korea ini mencabut pasak2 besi itu?",mengskar pasak yg ditanem jepang fungsinya segel kunci kalo sampeyan patriot korea mencabut pasak besi,1
"Menurutku mereka mau exhuma makam itu, tapi ditangkap atau digagalkan sama penduduk.",menurutku exhuma makam ditangkap ditidaktidaklkan penduduk,1
" @KhariqAnhar  Thanks, bro. Masuk akal juga itu.",khariqanhar thanks bro masuk akal jutidak,1
"mreka patriot pencabut pasak
pasakny ini ky sihir buat kunci kejayaan korea ( kata si kang fengsui kan gt , demi negara , t4 tinggal anak cucu nanti )

jd mreka mau bebasin macan (korea) dr kutukan pasak

makanya si zombi daimyo / shogun ini pasak gacoan terakhir terdebesnya

di lapis2 proteksinya
pasaknya ""idup dan bisa ngelawan"" , zombie gede kuat
yang ""otomatis"" balik ke titik pasak tiap hari kl dipindahin , jadi bola api n balik ke titik awal

dilapis lg diatasny ada kuburan kakekny mr.park",mreka patriot pencabut pasakpasakny ky sihir kunci kejayaan korea si kang fengsui gt netidakra t tingtidakl anak cucu jd mreka bebasin macan korea dr kutukan pasakmakanya si zombi daimyo shogun pasak tidakcoan terdebesnyadi lapis proteksinyapasaknya idup ngelawan zombie gede kuatyang otomatis titik pasak kl dipindahin bola api n titik awaldilapis lg diatasny kuburan kakekny mrpark,1
ditungguin loh ya~,ditungguin loh ya,1
Iya si Rasyid emang paling genius sih kalau masalah film,iya si rasyid emang genius sih film,1
Abis ntn the wailing pikiran dibikin gak jernih hampa sad kayak ada luka dan ikut nyesel😢😅,abis ntn the wailing pikiran dibikin tidakk jernih hampa sad kayak luka nyesel,1
bisa jadi n akan wajib nonton juga,n wajib nonton jutidak,1
"Lagian keberadaan si biang kerok Gisune jg ga jelas, apa jangan2 dia masih hidup dan menebar teror di tempat lain? Karena kan negara2 yg pernah di jajah Jepang bkn cuma Korea 😅",keberadaan si biang kerok gisune jg tidak jantidakn hidup menebar teror netidakra yg jajah jepang bkn korea,1
"Di X sudah ada yang bikin ginian, lebih lengkap malah wkwkwkwk",x bikin ginian lengkap wkwkwkwk,1
" @desmonadikara1091  siapp tks infonya, selalu terdepan bang 👍, tapi apresiasi gw tetap ga berkurang buat bang Rasyid",desmonadikara siapp tks infonya terdepan bang apresiasi gw tidak berkurang bang rasyid,0
​ @desmonadikara1091 drop the link bang,desmonadikaradrop the link bang,1
​ @desmonadikara1091 minta alamatnya dong di x,desmonadikaraminta alamatnya x,1
"Termasuk teori fengshui besi panas akan kalah dengan kayu basah, yaa?",teori fengshui besi panas kalah dentidakn kayu basah yaa,1
" @rizatrisnawati5804  kl g slh si jendral it dibuat unsurny api sm logam. Tp ditanam d tanah. Kl secara unsur tu buat kuatin logamnya, api menghasilkan tanah,tanah menghasilkan logam. Jd logamny d protect gt kayanya. Nah buat lemahin tanah sm apinya itu pakai air sm kayu (api kalah sm air, tanah kalah sm kayu) jd logamnya ke expose gt kl g slh ya cmiiw. Bkn ahli fengshui si cm tau2 aj hahaha",rizatrisnawati kl g slh si jendral it unsurny api sm lotidakm tp ditanam d tanah kl unsur tu kuatin lotidakmnya api menghasilkan tanahtanah menghasilkan lotidakm jd lotidakmny d protect gt kayanya lemahin tanah sm apinya pakai air sm kayu api kalah sm air tanah kalah sm kayu jd lotidakmnya expose gt kl g slh ya cmiiw bkn ahli fengshui si cm tau aj hahaha,1
" @rizatrisnawati5804  iya bener,pke teori fengshui itu,makanya bisa menang",rizatrisnawati iya benerpke teori fengshui itumakanya menang,1
Iya shogun ja,iya shogun ja,1
"1. karna jenderal itu ditugasin buat jaga koordinat punggung harimau, jadi kalo dia dipindah kemana aja dia bakal balik, pas dia jdi bola api dia kan balik ke kuburannya
2. makam orang kaya buat nutupin makam jenderal biar makam jenderal ga di cari2 orang",karna jenderal ditutidaksin jatidak koordinat punggung harimau kalo dipindah kemana aja pas jdi bola api kuburannya makam orang kaya nutupin makam jenderal biar makam jenderal tidak cari orang,1
"1. Klo yg digudang itu, sdh dijelaskan di filmnya bahwa si siluman menghindari ketan + darah kuda makanya dia lewat atas. Kecuali semisal darah kudanya di basahin di atas petinya, siluman bakalan ga bisa keluar (kayu + darah)
2. Peti mati pak park hanya sebagai pengalih krn waktu itu bnyak org yg maling kuburan. Klo untuk menambah segel harusnya tdk krn kejadian penguburan 2 peti tersebut ckup jauh jaraknya. Trus, klo semisal bs keluar tanpa ada peti mati diatasnya, harusnya dr awal peti vertikal sdh rusak.",klo yg digudang sdh filmnya si siluman menghindari ketan darah kuda kecuali darah kudanya basahin petinya siluman tidak kayu darah peti mati park sebatidaki pentidaklih krn bnyak org yg maling kuburan klo menambah segel tdk krn kejadian penguburan peti ckup jaraknya trus klo bs peti mati diatasnya dr peti vertikal sdh rusak,1
 @wongedan8799  point no 2 gimna maksudnya?,wongedan point no gimna maksudnya,1
"Iya bisa juga teorinya, karena peti kakek Park itu dari Kayu dimana Kayu itu melemahkan Logam (si Peti Jendral kalo ga salah Logam ya dan pasaknya dalam Jendral logam juga). Makanya dibahas itu peti-nya kakek Park keren banget sari Kayu mahal yang biasanya hanya dipakai oleh keluarga Kerajaan Korea.",iya jutidak teorinya peti kakek park kayu dimana kayu melemahkan lotidakm si peti jendral kalo tidak salah lotidakm ya pasaknya jendral lotidakm jutidak dibahas petinya kakek park keren banget sari kayu mahal dipakai keluartidak kerajaan korea,2
"CMIIW ya..
Di akhir inget kakek Kim bilang, tanah itu lawannya api, makanya itu api dikubur. Nah setelah dikebuka kuburannya ya jadi bebas.",cmiiw yadi inget kakek kim bilang tanah lawannya api api dikubur dikebuka kuburannya ya bebas,1
 @simonsetyadarma4225 kakek kim siapa ya? Yg mna adegan ini?,simonsetyadarmakakek kim ya yg mna adetidakn,1
"zombi shogun itu
pasak ""idup"" yg bisa lindungin diri sendiri n balik ke posisi awal(jadi api otw kekuburan) tiap malem kl sampe dia keluar posisi kordinat....",zombi shogun itupasak idup yg lindungin n posisi awaljadi api otw kekuburan malem kl sampe posisi kordinat,1
"Atau memang si jenderal jauh lebih sakti dari hwa rim, makanya segel darah kuda tetep jebol",si jenderal sakti hwa rim segel darah kuda tetep jebol,1
 @mengskar iya kyknya kecuali kitab buddha itu cuma disitu yg gkbisa dia ganggugugat,mengskariya kyknya kecuali kitab buddha disitu yg gkbisa tidaknggugutidakt,1
Kan bisa jebol karna lewat atap,jebol karna atap,1
Katanya hwa rim kan dia lewat atap krn diatas petinya ga dikasi ketan sm darah kuda,hwa rim atap krn diatas petinya tidak dikasi ketan sm darah kuda,1
Segelnya kan yg ular kepala orang itu dibakar di drum sblm mereka minum sop. Ketan kan cuma ditabur di kelilingnya. Atasnya nggak. Makanya kata dukun cewe itu dia terbang ke atas. Karena sekelilingnya ada segel ketan,segelnya yg ular kepala orang dibakar drum sblm minum sop ketan ditabur kelilingnya atasnya ngtidakk dukun cewe terbang sekelilingnya segel ketan,1
adaa... si biksu ini ada relasi ama kakek buyut nya mereka semacam biksu kepercayaan mereka. Tapi mereka gatau kalo ternyata si kakek dikubur disitu buat nutupin apa yang si biksu tanem. ibaratnya ditumbalin,adaa si biksu relasi ama kakek buyut nya biksu kepercayaan tidaktau kalo si kakek dikubur disitu nutupin si biksu tanem ditumbalin,1
Sama sama diritualin gisune ga sih??,diritualin gisune tidak sih,1
"Prajurit Jepangnya sama keluarga Park gak ada hubungannya. Hubungannya yaa cuma peti mati Kakek Park dikubur diatas peti mati Si Jenderal, buat nutupin kuburan Si Jenderal.",prajurit jepangnya keluartidak park tidakk hubuntidaknnya hubuntidaknnya yaa peti mati kakek park dikubur diatas peti mati si jenderal nutupin kuburan si jenderal,1
"Overated, kaya nonton Transformers seru, bukan jelek tapi ini film seru, kalau dibandingkan sama the wailing mah masih jauh.",overated kaya nonton transformers seru bukan jelek film seru dibandingkan the wailing mah,0
Fak jadi pengen nonton lagi😂,fak pengen nonton,1
"Finally dibahas jugaa, makasih cine crib",finally dibahas jutidaka makasih cine crib,1
Direview 2x donk😂,direview x donk,1
"Kenapa sang jendral jadi bola api pas liat pagoda? 

Apa yang terjadi pas jendral ketemu si neneknya hwa rim pas di hutan?",sang jendral bola api pas liat pagoda pas jendral ketemu si neneknya hwa rim pas hutan,1
Exhuma 😁👍,exhuma,1
Sama the medium bagusan mana bang?,the medium bagusan bang,2
Ada manusia di sini? 😵👻,manusia,1
jendral jurig idolaku🫡,jendral jurig idolaku,1
"barusan semalam nonton, studio penuh, suasana tegang sepanjang film. Kaya serial tapi jadi satu film, ngangkat budaya misitis Korea-Jepang jadi nilai lebih",barusan semalam nonton studio penuh suasana tetidakng film kaya serial film ntidakngkat budaya misitis koreajepang nilai,1
"Wkwkwkwkwk kirain gw doang yg pas selesai nonton pelemnya, ""ini mereka ngomongin tentang apaseh?????""",wkwkwkwkwk kirain gw doang yg pas selesai nonton pelemnya ngomongin apaseh,1
"Kelar nntn, yg kupikirkan itu gimana cara hantunya bisa bolak balik korea amerika :')",kelar nntn yg kupikirkan gimana hantunya bolak korea amerika,1
Yg jadi seru karna horror nya relate sama kita cuman kemasan nya aj yg keren 😂,yg seru karna horror nya relate cuman kemasan nya aj yg keren,2
Halo kim go eun,halo kim go eun,1
Film horor kesukaanku tahun ini 😘😘,film horor kesukaanku,2
The Wailing karena ga nonton dibioskop  dan pengalaman  nonton di PC ga ada sensasinya jd biasa saja😂 walau  brutal tp exhuma beda sensasinya,the wailing tidak nonton dibioskop pentidaklaman nonton pc tidak sensasinya jd brutal tp exhuma beda sensasinya,1
Ini bukan review tapi ngebahas dan membedah teori,bukan review ngebahas membedah teori,1
Bukannya ini karna itu udah mau pagi ya? Kan juga disebutin kalo jenderal itu bangkit pas tengah malam (12malam),karna udah pagi ya jutidak disebutin kalo jenderal bangkit pas tentidakh malam malam,1
" @hanafi7519  soalnya kan by dialog jendralnya nyebut “pagoda.” Pas mau nyerang hwa rim lagi, eh terus dia berubah jadi bola api kayaknya aneh kalo ga ada hubungannya sama pagoda tapi si jendral mention pagoda",hanafi by dialog jendralnya nyebut pagoda pas nyerang hwa rim eh berubah bola api kayaknya aneh kalo tidak hubuntidaknnya pagoda si jendral mention pagoda,0
"si jendral ini budhist kak, jadi dia kalau liat pagoda ya respect gt. kalau pas ketemu sm leluhurnya hwarim nggak tau sih, soalnya nggak di jelasin secara explicit.",si jendral budhist kak liat pagoda ya respect gt pas ketemu sm leluhurnya hwarim ngtidakk tau sih ngtidakk jelasin explicit,1
" @justhypewwsm  oh berarti masuk akalnya sama kayak kenapa dia ga nyerang bagian tubuh yang ada tatto kitab buddhistnya ya, makanya dia ngga nyerang hwa rim yang lagi ditengah” pagoda",justhypewwsm oh masuk akalnya kayak tidak nyerang tubuh tatto kitab buddhistnya ya ngtidak nyerang hwa rim ditentidakh pagoda,1
"kyny g ada hubungannya sama pagoda juga jadi apinya

yg jadi api ke 2 kan gada pagoda

kyny sistemny waktu
misal setelah 1jam dari jam bangkit dia balik ke t4 asal

niatny gisune y gitu
si zombi shogun ini pancang ""idup"" yg bisa ""jaga diri"" dan balik lg ke kordinat awal otomatis tiap hari dijam yang sama
biar pancang di pinggul macan ttp nancep selamanya
jagobener si siluman rubah

si nenek ngulur waktu , ngapainnya g tau",kyny g hubuntidaknnya pagoda jutidak apinyayg api tidakda pagodakyny sistemny waktumisal jam jam bangkit t asalniatny gisune y gitusi zombi shogun pancang idup yg jatidak lg kordinat otomatis dijam samabiar pancang pinggul macan ttp nancep selamanyajagobener si siluman rubahsi nenek ngulur ntidakpainnya g tau,1
"beda konsep si, lebih menyeramkan the medium tapi lebih keren cerita exhuma",beda konsep si menyeramkan the medium keren cerita exhuma,2
"Harusnya bandinginnya sama The Wailing, sama2 jepang korea wkwkw. Masing2 film asik sih, mending tonton aja semuanya",bandinginnya the wailing jepang korea wkwkw film asik sih mending tonton aja,1
​ @phoenixfirekiara The wailing nontonnya di man?,phoenixfirekiarathe wailing nontonnya man,1
mau ikan n melon,ikan n melon,1
Klo fokus sih jelas bgt padahal dialog2 nya ceritain tntg apa 😂,klo fokus sih bgt dialog nya ceritain tntg,1
" @liburanmulu  nah itu ka, aku kurang bisa nangkep dialog korea yg temponya menurutku cepet bgd :"""""""" otak aku lola :""",liburanmulu ka nangkep dialog korea yg temponya menurutku cepet bgd otak lola,1
"Genetic. ""curse""nya lintas genetik. Lokasiny mo dmn aja ttep kena.",genetic cursenya lintas genetik lokasiny mo dmn aja ttep kena,1
"​ @vavin4553  Mantap masuk akal ini, akhirnya menolong keherananku. Soalnya pernah denger kalo setan/jin/iblis ga bisa melintasi negara lain. Dan ini jawaban yang masuk akal juga",vavin mantap masuk akal menolong keherananku denger kalo setanjiniblis tidak melintasi netidakra masuk akal jutidak,2
 @vavin4553 tapi ada yg bilang kalo santet gak akan sampe kalo beda negera,vavintapi yg bilang kalo santet tidakk sampe kalo beda negera,1
Hantunya bisa bolak balik Korea Amerika tapi ga bisa nembus jendela,hantunya bolak korea amerika tidak nembus jendela,1
" @mayawardiana9841 Konsepnya kayak kita yg hidup harus ngundang mereka masuk dulu ke rumah baru bisa. Kalo kita gak ngundang (*kayak bukain jendela), mereka gak bisa masuk. CMIIW.",mayawardianakonsepnya kayak yg hidup ngundang masuk rumah kalo tidakk ngundang kayak bukain jendela tidakk masuk cmiiw,1
 @mayawardiana9841 gak bisa nembus kayu peti jg gak bisa nembus tanah kuburan wkwwkwkwk😂,mayawardianatidakk nembus kayu peti jg tidakk nembus tanah kuburan wkwwkwkwk,1
​ @mayawardiana9841 aduh ka 😂😂😂 jd ngakak,mayawardianaaduh ka jd ntidakkak,1
nama juga setan,nama jutidak setan,1
Saya juga bingung kenapa hantu jepang bisa ngomong korea,jutidak bingung hantu jepang ngomong korea,1
"​​ @mul9116 Itu hantu jepang era penjajahan. Sama kayak orang belanda di era penjajahan beberapa bisa bahasa indonesia dasar. Korea dijajah jepang ratusan tahun, mangkanya hantu dan siluman jepang kayak benci banget sama orang korea, karena pada masa penjajahan orang korea dianggap sangat hina oleh orang jepang (sejarah yg sangat kelam dari korea dan jepang), mangkanya si Kim Go Un bilang hantu jepang akan membunuh semua orang korea yg dia lihat, karena pada jaman penjajahan prajurit dan orang jepang yg ada di tanah korea adalah orang-orang yg sangat angkuh dan menganggap diri mereka sangat tinggi dibandingkan orang korea.",mulitu hantu jepang era penjajahan kayak orang belanda era penjajahan bahasa indonesia dasar korea dijajah jepang ratusan mangkanya hantu siluman jepang kayak benci banget orang korea penjajahan orang korea diangtidakp santidakt hina orang jepang sejarah yg santidakt kelam korea jepang mangkanya si kim go un bilang hantu jepang membunuh orang korea yg lihat jaman penjajahan prajurit orang jepang yg tanah korea orangorang yg santidakt angkuh mentidakngtidakp santidakt dibandingkan orang korea,1
"Ini krn ada kepercayaan masyarakat kita, kalo lintas laut atau samudera modelan setan atau santet ga bisa ngikut,, 😂",krn kepercayaan masyarakat kalo lintas laut samudera modelan setan santet tidak ngikut,1
"Soalnya logic spiritual, klenik, dan perdukunan di Indonesia itu pemahaman yang terbangun bahwa pengaruh gaib bakal ilang kalo nyeberang pulau ..",logic spiritual klenik perdukunan indonesia pemahaman terbangun pentidakruh tidakib ilang kalo nyeberang pulau,1
"😂 numpang pesawat bisa, ya atw alam roh emang beda lbh satset2.",numpang pesawat ya atw alam roh emang beda lbh satset,1
"​ @rlsoe-zn7uo betul bisa lewat alam roh, kayak di Avatar Kora",rlsoeznuobetul alam roh kayak avatar kora,1
Lagi banyak promo traveloka,promo traveloka,1
​ @GATESOFANTARES pake promo traveloka bolak balik takut mahal😂,tidaktesofantarespake promo traveloka bolak takut mahal,1
😂😂😂😂​ @GATESOFANTARES ,tidaktesofantares,1
Yg ke amrik itu hantu kakeknya bukan hantu jepang yg jd pasak,yg amrik hantu kakeknya bukan hantu jepang yg jd pasak,1
Lewat ‘keturunan’nya kak,keturunannya kak,1
Karena hantunya bukan dari jawa,hantunya bukan jawa,1
 @alditahervianto9179  ((hantunya bukan dr Jawa)) 🤣🙏 krn klo dr Jawa sopan,alditahervianto hantunya bukan dr jawa krn klo dr jawa sopan,1
"Udah gitu pas di korea malem malem, ke amerika selang berapa menit doang, malem juga di amrik.

Timezone ga eksis di film ini",udah gitu pas korea malem malem amerika selang menit doang malem jutidak amriktimezone tidak eksis film,1
" @CozyCassette1  mungkin dia terbang malam d Korea, sampai sananya malam jg Kk/ beraksinya d mlm hr",cozycassette terbang malam d korea sananya malam jg kk beraksinya d mlm hr,1
Namanya juga setan bisa kemana saja,namanya jutidak setan kemana,1
Sekomplek itu yah pemikiran anak cucu Adam zaman now,sekomplek yah pemikiran anak cucu adam zaman now,1
"Kan dia deket sama Jepang dulu pas masih hidupnya. Mungkin dipinjemin teknologinya Jepang, —pintu kemana saja",deket jepang pas hidupnya dipinjemin teknologinya jepang pintu kemana,1
Kan ada JNE,jne,1
 @lagustiono91  🤣yg OneNightSvc ya,lagustiono yg onenightsvc ya,1
iya setannya bisa lintas benua banget ya,iya setannya lintas benua banget ya,1
Ada bbrp airlines di Amrik yg. Kasih diskon khusus buat mahluk2 halus.,bbrp airlines amrik yg kasih diskon khusus mahluk halus,1
Hantunya crazy rich mbak jd mudah buat dia keliling dunia.,hantunya crazy rich mbak jd mudah keliling dunia,1
Di indo cocok tu jokowi  jafi film,indo cocok tu jokowi jafi film,1
